<?xml version="1.0" encoding="UTF-8"?>
<BusinessRules schemaversie="1.0.3"
  xmlns="https://standaarden.overheid.nl/stop/imop/businessrules/"
  xmlns:xsi="http://www.w3.org/2001/XMLSchema-instance"
  xsi:schemaLocation="https://standaarden.overheid.nl/stop/imop/businessrules/
  https://standaarden.overheid.nl/stop/1.0.3/imop-businessrules.xsd">
  <BusinessRuleGroep>
    <groepsnaam>AMvB/MR</groepsnaam>
    <id>BRG0001</id>
    <geldtVoor>
      <soortRegeling>/join/id/stop/regelingtype_001</soortRegeling>
      <soortRegeling>/join/id/stop/regelingtype_002</soortRegeling>
    </geldtVoor>
    <geldendeBusinessRules>
      <BusinessRule>
        <code>TPOD1830</code>
        <ernst>waarschuwing</ernst>
        <regel>Binnen het object ‘Gebiedsaanwijzing’ is de waarde ‘functie’ van attribuut ‘type’ (datatype TypeGebiedsaanwijzing) niet toegestaan. (voor AMvB/MR)</regel>
        <melding>Binnen het object ‘Gebiedsaanwijzing’ in AMvB/MR is de waarde ‘Functie’ van
          attribuut ‘type’ (datatype TypeGebiedsaanwijzing) niet toegestaan. Het object waarom het
          gaat: <var naam="object-identificatie" />
        </melding>
      </BusinessRule>
      <BusinessRule>
        <code>TPOD1840</code>
        <ernst>waarschuwing</ernst>
        <regel>Binnen het object ‘Gebiedsaanwijzing’ is de waarde ‘beperkingengebied’ van attribuut ‘type’ (datatype TypeGebiedsaanwijzing) niet toegestaan. (voor AMvB/MR) </regel>
        <melding>Binnen het object ‘Gebiedsaanwijzing’ in AMvB/MR is de waarde ‘Beperkingengebied’
          van attribuut ‘type’ (datatype TypeGebiedsaanwijzing) niet toegestaan. Het object waarom
          het gaat: <var naam="object-identificatie" />
        </melding>
        <documentatie>
          <link href="TODO link naar documentatie" />
        </documentatie>
      </BusinessRule>
    </geldendeBusinessRules>
  </BusinessRuleGroep>
  <BusinessRuleGroep>
    <groepsnaam>Omgevingsplan</groepsnaam>
    <id>BRG0002</id>
    <geldtVoor>
      <soortRegeling>/join/id/stop/regelingtype_003</soortRegeling>
    </geldtVoor>
    <geldendeBusinessRules>
      <BusinessRule>
        <code>TPOD1790</code>
        <ernst>fout</ernst>
        <regel>Het IMOW-object 'Instructieregel' is niet van toepassing (voor Omgevingsplan).</regel>
        <melding>TPOD1790: Het IMOW-object 'Instructieregel' is niet van toepassing. Betreft: <var
            naam="TODO var-naam ipv XPath string(r:artikelOfLid/r:RegeltekstRef/@xlink:href)" />
        </melding>
        <documentatie>
          <link href="TODO link naar documentatie" />
        </documentatie>
      </BusinessRule>
    </geldendeBusinessRules>
  </BusinessRuleGroep>
  <BusinessRuleGroep>
    <groepsnaam>OP-implementatie-GemeentenEnWaterschappen</groepsnaam>
    <id>BRG0003</id>
    <geldtVoor>
      <soortRegeling>/join/id/stop/regelingtype_003</soortRegeling>
      <soortRegeling>/join/id/stop/regelingtype_005</soortRegeling>
    </geldtVoor>
    <geldendeBusinessRules>
      <BusinessRule>
        <code>TPOD0740</code>
        <ernst>waarschuwing</ernst>
        <regel>Artikelen moeten oplopend worden genummerd in Arabische cijfers.</regel>
        <melding>TPOD_0740: Artikelnummers moeten oplopend worden genummerd in Arabische cijfers
          (betreft hoofdstuk: <var naam="TODO var-naam ipv XPath $hoofdstuk" />, artikelen: <var
            naam="TODO var-naam ipv XPath substring($volgorde, 1, string-length($volgorde) - 2)"
           />)</melding>
        <documentatie>
          <link href="TODO link naar documentatie" />
        </documentatie>
      </BusinessRule>
      <BusinessRule>
        <code>TPOD0780</code>
        <ernst>waarschuwing</ernst>
        <regel>Leden moeten per artikel oplopend genummerd worden in Arabische cijfers.</regel>
        <melding>TPOD_0780: Leden moeten per artikel oplopend genummerd worden in Arabische cijfers
          (en indien nodig, een letter). (betreft artikel: <var naam="TODO var-naam ipv XPath
            $artikel" />, leden: <var naam="TODO var-naam ipv XPath substring($volgorde, 1,
            string-length($volgorde) - 2)" />)</melding>
        <documentatie>
          <link href="TODO link naar documentatie" />
        </documentatie>
      </BusinessRule>
      <BusinessRule>
        <code>TPOD0830</code>
        <ernst>waarschuwing</ernst>
        <regel>De onderdelen van de Lijst op het eerste niveau moeten worden aangegeven met letters.</regel>
        <melding>TPOD_0830: functie, hoe doe ik dit.</melding>
        <documentatie>
          <link href="TODO link naar documentatie" />
        </documentatie>
      </BusinessRule>
      <BusinessRule>
        <code>TPOD0840</code>
        <ernst>waarschuwing</ernst>
        <regel>De onderdelen van de Lijst op het tweede niveau moeten worden aangegeven met Arabische cijfers.</regel>
        <melding>TPOD_0840: functie, hoe doe ik dit</melding>
        <documentatie>
          <link href="TODO link naar documentatie" />
        </documentatie>
      </BusinessRule>
      <BusinessRule>
        <code>TPOD0850</code>
        <ernst>waarschuwing</ernst>
        <regel>De onderdelen van de Lijst op het derde niveau moeten worden aangegeven met Arabische cijfers.</regel>
        <melding>TPOD_0850: functie, hoe doe ik dit</melding>
        <documentatie>
          <link href="TODO link naar documentatie" />
        </documentatie>
      </BusinessRule>
    </geldendeBusinessRules>
  </BusinessRuleGroep>
  <BusinessRuleGroep>
    <groepsnaam>OP-implementatie-generiek</groepsnaam>
    <id>BRG0004</id>
    <geldtVoor>
      <soortRegeling>/join/id/stop/regelingtype_001</soortRegeling>
      <soortRegeling>/join/id/stop/regelingtype_002</soortRegeling>
      <soortRegeling>/join/id/stop/regelingtype_003</soortRegeling>
      <soortRegeling>/join/id/stop/regelingtype_004</soortRegeling>
      <soortRegeling>/join/id/stop/regelingtype_005</soortRegeling>
      <soortRegeling>/join/id/stop/regelingtype_006</soortRegeling>
      <soortRegeling>/join/id/stop/regelingtype_007</soortRegeling>
      <soortRegeling>/join/id/stop/regelingtype_008</soortRegeling>
      <soortRegeling>/join/id/stop/regelingtype_009</soortRegeling>
      <soortRegeling>/join/id/stop/regelingtype_010</soortRegeling>
      <soortRegeling>/join/id/stop/regelingtype_011</soortRegeling>
    </geldtVoor>
    <geldendeBusinessRules>
      <BusinessRule>
        <code>TPOD0940</code>
        <ernst>fout</ernst>
        <regel>Als een Locatie uit meer dan één geometrie bestaat, dan moeten de geometrieën volgens dezelfde coordinate reference system (crs) zijn opgebouwd.</regel>
        <melding>H:TP0D940: Een geometrie moet zijn opgebouwd middels één coordinate reference
          system (crs): EPSG:28992 (=RD new) of EPSG:4258 (=ETRS89). Id=<var naam="TODO var-naam ipv
            XPath parent::*/basisgeo:id" /> bevat een combinatie van beiden. </melding>
        <documentatie>
          <link href="TODO link naar documentatie" />
        </documentatie>
      </BusinessRule>
      <BusinessRule>
        <code>TPOD1010</code>
        <ernst>waarschuwing</ernst>
        <regel>Begrippen moeten in alfabetische volgorde worden gesorteerd.</regel>
        <melding>TPOD_1010_1060: Een Begriplijst moet gesorteerd zijn, de Begrippenlijst met wId:
            "<var naam="TODO var-naam ipv XPath $items" />" is dat niet</melding>
        <documentatie>
          <link href="TODO link naar documentatie" />
        </documentatie>
      </BusinessRule>
    </geldendeBusinessRules>
  </BusinessRuleGroep>
  <BusinessRuleGroep>
    <groepsnaam>OP-implementatie-niet-Rijk</groepsnaam>
    <id>BRG0005</id>
    <geldtVoor>
      <soortRegeling>/join/id/stop/regelingtype_003</soortRegeling>
      <soortRegeling>/join/id/stop/regelingtype_004</soortRegeling>
      <soortRegeling>/join/id/stop/regelingtype_005</soortRegeling>
      <soortRegeling>/join/id/stop/regelingtype_006</soortRegeling>
      <soortRegeling>/join/id/stop/regelingtype_007</soortRegeling>
      <soortRegeling>/join/id/stop/regelingtype_008</soortRegeling>
      <soortRegeling>/join/id/stop/regelingtype_009</soortRegeling>
      <soortRegeling>/join/id/stop/regelingtype_010</soortRegeling>
      <soortRegeling>/join/id/stop/regelingtype_011</soortRegeling>
    </geldtVoor>
    <geldendeBusinessRules>
      <BusinessRule>
        <code>TPOD0410</code>
        <ernst>waarschuwing</ernst>
        <regel>Een Hoofdstuk moet worden geduid met de label Hoofdstuk.</regel>
        <melding>TPOD_0410: Een Hoofdstuk moet worden geduid met de label Hoofdstuk. (betreft
          hoofdstuk: <var naam="TODO var-naam ipv XPath tekst:Nummer" />, label: <var naam="TODO
            var-naam ipv XPath tekst:Label" />)</melding>
        <documentatie>
          <link href="TODO link naar documentatie" />
        </documentatie>
      </BusinessRule>
      <BusinessRule>
        <code>TPOD0420</code>
        <ernst>waarschuwing</ernst>
        <regel>Hoofdstukken moeten oplopend worden genummerd in Arabische cijfers.</regel>
        <melding>TPOD_0420: Hoofdstukken moeten oplopend worden genummerd in Arabische cijfers
          (betreft hoofdstukken: <var naam="TODO var-naam ipv XPath
            substring($volgorde,1,string-length($volgorde)-2)" />)</melding>
        <documentatie>
          <link href="TODO link naar documentatie" />
        </documentatie>
      </BusinessRule>
      <BusinessRule>
        <code>TPOD0460</code>
        <ernst>waarschuwing</ernst>
        <regel>Een Titel moet worden geduid met de label Titel.</regel>
        <melding>TPOD_0460: Een Titel moet worden geduid met de label Titel. Betreft titel, label:
            <var naam="TODO var-naam ipv XPath tekst:Nummer" />:<var naam="TODO var-naam ipv XPath
            tekst:Label" />
        </melding>
        <documentatie>
          <link href="TODO link naar documentatie" />
        </documentatie>
      </BusinessRule>
      <BusinessRule>
        <code>TPOD0470</code>